cid,text,time,author,channel,votes,photo,heart,replies_count,video_id,video_title,video_published_at
UgzXLsmm2yMyxxJLjb94AaABAg,"Интересно, что я когда у меня лихорадка я всегда с жаром, красная <br>А муж всегда бледный, под десятью одеялами <br>Такие разные типы по жизни",2025-02-07T15:27:56Z,@springmelody916,UCtZUZtjINKL0I2wrttD6p0w,0,https://yt3.ggpht.com/ytc/AIdro_n2udBzeYBteVO94AOvACDKqyHN4sBTqV2YenVzO3Y2Ic5h7sd9c1UhQi-g7V9kvb_L3A=s48-c-k-c0x00ffffff-no-rj,False,0,oDJhDApDHSg,Очень высокая температура - 3 частые ошибки и 3 важных совета от #докторлиза #nikolife,2025-02-07T14:31:31Z
Ugy5nOeRzdapt9sI9yl4AaABAg,"Спасибо, никогда не сбивала температуру ребенку, всегда все супер , хотя значения и 40 были, но выхаживание все решает 🙏 <br>Так важно не вмешиваться в процесс, это точно",2025-02-07T15:26:56Z,@springmelody916,UCtZUZtjINKL0I2wrttD6p0w,0,https://yt3.ggpht.com/ytc/AIdro_n2udBzeYBteVO94AOvACDKqyHN4sBTqV2YenVzO3Y2Ic5h7sd9c1UhQi-g7V9kvb_L3A=s48-c-k-c0x00ffffff-no-rj,False,0,oDJhDApDHSg,Очень высокая температура - 3 частые ошибки и 3 важных совета от #докторлиза #nikolife,2025-02-07T14:31:31Z
UgxiGYe-cCYDSuT9A-V4AaABAg,Мне в детстве всегда сбивали температуру,2025-02-07T14:42:24Z,@theilyaefimov,UCTZ9c0lYLm1nVzor9iJhuKg,0,https://yt3.ggpht.com/ytc/AIdro_nb_izmwfFmt9UWr6nV1__tYmSQ_ydq0kXeGwpNDyGfxsA=s48-c-k-c0x00ffffff-no-rj,False,1,oDJhDApDHSg,Очень высокая температура - 3 частые ошибки и 3 важных совета от #докторлиза #nikolife,2025-02-07T14:31:31Z
UgwgZtrK33zECI5bBV14AaABAg,"А если температура выше 39 надо сбивать уже? И еще вопрос: если долго держится, это уже показание к антибиотикам?",2025-02-07T14:35:33Z,@КсенияНарчук,UCPRs0PNcgAWedBMt2BdoLMA,1,https://yt3.ggpht.com/ytc/AIdro_m26DoBrFevEtPD2h7hf-a7Er2umdlsUStHx1-1NoDvmwejotONRP4CZUmOOvKHycWq9aA=s48-c-k-c0x00ffffff-no-rj,False,0,oDJhDApDHSg,Очень высокая температура - 3 частые ошибки и 3 важных совета от #докторлиза #nikolife,2025-02-07T14:31:31Z
Ugx1SUDx-4LqRfnPVMp4AaABAg,"<a href=""https://t.me/dok_liza"">https://t.me/dok_liza</a> Здесь все активные ссылки, будьте здоровы! ❤",2025-02-04T11:53:46Z,@dok_liza,UC1Sx5ZuAhIGk35hsUzb7Evw,0,https://yt3.ggpht.com/JViULz6ADsa4rt_eCCaugKIM0URlhwVJGE7QPsTk5pg_1Uvv9cY2bNwt6YP_q1r-CWDRwHYMJQ=s48-c-k-c0x00ffffff-no-rj,False,0,207j1TeYwDo,ДАЮ ПОДБОРКУ ПОЛЕЗНЫХ СЛАДОСТЕЙ ДЛЯ ДЕТЕЙ - ОДОБРЕНО ДОКТОРОМ#докторлиза пиши комментарий!#nikolife,2025-02-03T14:30:02Z
UgxQPYmLk5r0pmj_pE94AaABAg,Какой Кирюша ❤,2025-02-03T15:51:28Z,@ВиксСмолякова,UCw2D47Jy-pjgf1vySV_BalA,0,https://yt3.ggpht.com/ytc/AIdro_myBJazhnvw4Uk8XJ6hN28r0uPDWqECyembfsXApsTuz4o=s48-c-k-c0x00ffffff-no-rj,False,1,207j1TeYwDo,ДАЮ ПОДБОРКУ ПОЛЕЗНЫХ СЛАДОСТЕЙ ДЛЯ ДЕТЕЙ - ОДОБРЕНО ДОКТОРОМ#докторлиза пиши комментарий!#nikolife,2025-02-03T14:30:02Z
Ugwc0aHiQsfMqRTukqx4AaABAg,🔥🔥🔥,2025-02-13T02:26:33Z,@zaitseva_nasti,UCd7JLPIoIsQn57imMnxPxtQ,0,https://yt3.ggpht.com/lFpawR9qfJtdh6YXssTCw20Ov1Y0AEfWmHgLRg7TAHtlNX0Cw6qibI-Kh7NlIbN5AbPPkUM4Eg=s48-c-k-c0x00ffffff-no-rj,False,0,Mt0Yt1xfYdc,ТАК МЫ ИЗБАВИЛИСЬ ОТ БОРОДАВОК! Я даже не поверила! Одно средство от #докторлиза #nikolife,2025-01-31T14:30:18Z
Ugy6-7jZD8O3zQzYloZ4AaABAg,Ого,2025-02-03T15:52:18Z,@ВиксСмолякова,UCw2D47Jy-pjgf1vySV_BalA,0,https://yt3.ggpht.com/ytc/AIdro_myBJazhnvw4Uk8XJ6hN28r0uPDWqECyembfsXApsTuz4o=s48-c-k-c0x00ffffff-no-rj,False,0,Mt0Yt1xfYdc,ТАК МЫ ИЗБАВИЛИСЬ ОТ БОРОДАВОК! Я даже не поверила! Одно средство от #докторлиза #nikolife,2025-01-31T14:30:18Z
UgwKsrRO80KawHI1GD94AaABAg,Какое масло лучше выбрать?,2025-01-31T17:32:04Z,@theilyaefimov,UCTZ9c0lYLm1nVzor9iJhuKg,0,https://yt3.ggpht.com/ytc/AIdro_nb_izmwfFmt9UWr6nV1__tYmSQ_ydq0kXeGwpNDyGfxsA=s48-c-k-c0x00ffffff-no-rj,False,0,Mt0Yt1xfYdc,ТАК МЫ ИЗБАВИЛИСЬ ОТ БОРОДАВОК! Я даже не поверила! Одно средство от #докторлиза #nikolife,2025-01-31T14:30:18Z
Ugx9kfFaGMqtMqnrzdx4AaABAg,С Благодарностью и в Принятии!!! ❤❤❤,2025-06-29T09:04:51Z,@Светлана-р5ф2ъ,UCBv0m8Vw8nWHRJ_PX-l98iw,0,https://yt3.ggpht.com/eZZI9V2CXgGMu1pkT_KRMeo7Yfx8H7DKKhbw7sMnmKoL4GtTuSJj_Z1nNgq5W54ZhbBKIpzSfQ=s48-c-k-c0x00ffffff-no-rj,False,0,YAGMiRQonbU,"5 продуктов, которые я НЕ ЕМ БОЛЕЕ 3 лет и вам НЕ СОВЕТУЮ! #докторлиза  #nikolife",2025-01-31T14:30:14Z
Ugxm6yqHuADYyeprmuJ4AaABAg,"Да сейчас все силят на Кока-Кола,и взрослые и дети",2025-06-13T17:41:36Z,@Айрэнд7ю,UClZmaqlSHtVrTu0fmgJxBbg,0,https://yt3.ggpht.com/ytc/AIdro_ny7st1locAcgG0EnCWcJW7oeYW3ZC-sZa2hyH_DB95KmoBHLpA2nIDXEkXj_G1s4LdoIA=s48-c-k-c0x00ffffff-no-rj,False,0,YAGMiRQonbU,"5 продуктов, которые я НЕ ЕМ БОЛЕЕ 3 лет и вам НЕ СОВЕТУЮ! #докторлиза  #nikolife",2025-01-31T14:30:14Z
UgzezgtdyBuMQn1FJvl4AaABAg,"Да кого ебет что ты ешь, а что ты не ешь. Я тебя не знаю и зачем ты раздаёшь свои непрошенные советы неизвестно. Что ты там ешь за экраном - непроверяемая информация",2025-02-04T01:46:34Z,@csenuber,UCMVX5wttHCQKl19bylz80Zw,0,https://yt3.ggpht.com/ytc/AIdro_lXuZduyWS08pOHZkehNU7OlqoFRENbPl6QwsWjm0Y=s48-c-k-c0x00ffffff-no-rj,False,0,YAGMiRQonbU,"5 продуктов, которые я НЕ ЕМ БОЛЕЕ 3 лет и вам НЕ СОВЕТУЮ! #докторлиза  #nikolife",2025-01-31T14:30:14Z
UgyKZyntBticxpOwJtt4AaABAg,"Доктор Лиза, а что думаете про горчичное масло? Для жарки. У него высокая точка дымления, но про него мало рассказывают",2025-02-01T15:36:03Z,@zaitseva_nasti,UCd7JLPIoIsQn57imMnxPxtQ,1,https://yt3.ggpht.com/lFpawR9qfJtdh6YXssTCw20Ov1Y0AEfWmHgLRg7TAHtlNX0Cw6qibI-Kh7NlIbN5AbPPkUM4Eg=s48-c-k-c0x00ffffff-no-rj,False,0,YAGMiRQonbU,"5 продуктов, которые я НЕ ЕМ БОЛЕЕ 3 лет и вам НЕ СОВЕТУЮ! #докторлиза  #nikolife",2025-01-31T14:30:14Z
Ugzpntb5n0bU8zmHddx4AaABAg,"Самое обидное, что даже в масле с хорошим составом и хорошей стоимостью также может быть растительный жир. Проверяю домашними тестами, все пачки его не проходят",2025-02-01T15:34:14Z,@zaitseva_nasti,UCd7JLPIoIsQn57imMnxPxtQ,0,https://yt3.ggpht.com/lFpawR9qfJtdh6YXssTCw20Ov1Y0AEfWmHgLRg7TAHtlNX0Cw6qibI-Kh7NlIbN5AbPPkUM4Eg=s48-c-k-c0x00ffffff-no-rj,False,0,YAGMiRQonbU,"5 продуктов, которые я НЕ ЕМ БОЛЕЕ 3 лет и вам НЕ СОВЕТУЮ! #докторлиза  #nikolife",2025-01-31T14:30:14Z
UgwEqVDxPr-qbKTIDrF4AaABAg,"Док Лиза, как же мне теперь жить без газировки и колбасы 🥲🥲🥲Как доктор Кирюша с этим справляется?",2025-01-31T16:16:16Z,@alexeyleontev8350,UCWWBPaoNuyVp3auOf7jSOAA,0,https://yt3.ggpht.com/ytc/AIdro_kQ_FYWdSiaZgdzen80sBzXFCYVxXhWwVwdJ0z17FrhKQ0=s48-c-k-c0x00ffffff-no-rj,False,0,YAGMiRQonbU,"5 продуктов, которые я НЕ ЕМ БОЛЕЕ 3 лет и вам НЕ СОВЕТУЮ! #докторлиза  #nikolife",2025-01-31T14:30:14Z
UgwEF6i1XvaoENEvtvd4AaABAg,Как классно ❤❤❤,2025-01-31T14:54:12Z,@nikolife_nutrition,UCmefq5JW-K3Nt1gMsAkpysA,1,https://yt3.ggpht.com/jiysXBdI3R9YTep_WDiDdfKWguXUxa8F7kbCSDa8ZbFzVsJvPJpHqIsAkb07lpugExrVIZnezA=s48-c-k-c0x00ffffff-no-rj,False,0,YAGMiRQonbU,"5 продуктов, которые я НЕ ЕМ БОЛЕЕ 3 лет и вам НЕ СОВЕТУЮ! #докторлиза  #nikolife",2025-01-31T14:30:14Z
UgyYcYeDGPfFrrVeQIV4AaABAg,Боже..я всегда была очень скучной и не ела ничего из перечисленного  😅,2025-01-31T14:53:19Z,@Ольга-ш3у5о,UCzkcyw-FlspC4Ksn8hQpkzA,0,https://yt3.ggpht.com/BKv1u4seTQoveAjfyQUbq0skyRDQqhvrl_cbSWVVhS7zOKtJONOrZNdj-10IakSEEotZ8yQp=s48-c-k-c0x00ffffff-no-rj,False,0,YAGMiRQonbU,"5 продуктов, которые я НЕ ЕМ БОЛЕЕ 3 лет и вам НЕ СОВЕТУЮ! #докторлиза  #nikolife",2025-01-31T14:30:14Z
Ugzx5kssgnqjJU6-Xtt4AaABAg,Помню в 11 классе я пила жиросжигатели из спорт пита вместе с кофе 🤣 спасибо что живой 🙈🙈🙈,2025-01-31T14:47:43Z,@СофьяДробышева-п9б,UCsaSO2S1ePmJL9IF7KKDbBg,1,https://yt3.ggpht.com/ytc/AIdro_mnL4OPZDwV0ZvwJiguMBZjFKDItNkMkZtzfc4GW9JuiFYMhEu_vCOr9oFwC0xho5j1CpY=s48-c-k-c0x00ffffff-no-rj,False,1,YAGMiRQonbU,"5 продуктов, которые я НЕ ЕМ БОЛЕЕ 3 лет и вам НЕ СОВЕТУЮ! #докторлиза  #nikolife",2025-01-31T14:30:14Z
UgyZD8B7zeLu3svvHMJ4AaABAg,Полезно,2025-01-31T14:47:42Z,@Nikolife_Family,UCZUMOSCMnA1cf9Y-oCqwIAg,1,https://yt3.ggpht.com/wE2OC3KMnKRJ20BvIm4iCHCAwyezPw4jXdEpVuIjQznL_NWQBnTI5k6vjWutpd5ek4Yd_YRr=s48-c-k-c0x00ffffff-no-rj,False,0,YAGMiRQonbU,"5 продуктов, которые я НЕ ЕМ БОЛЕЕ 3 лет и вам НЕ СОВЕТУЮ! #докторлиза  #nikolife",2025-01-31T14:30:14Z
UgwJfyfqmk1dm4j3xDZ4AaABAg,"А не вредно ли пить просто газированную воду, Доктор Лиза?",2025-01-31T14:46:09Z,@СофьяДробышева-п9б,UCsaSO2S1ePmJL9IF7KKDbBg,1,https://yt3.ggpht.com/ytc/AIdro_mnL4OPZDwV0ZvwJiguMBZjFKDItNkMkZtzfc4GW9JuiFYMhEu_vCOr9oFwC0xho5j1CpY=s48-c-k-c0x00ffffff-no-rj,False,0,YAGMiRQonbU,"5 продуктов, которые я НЕ ЕМ БОЛЕЕ 3 лет и вам НЕ СОВЕТУЮ! #докторлиза  #nikolife",2025-01-31T14:30:14Z
Ugw4GJNTVrKMU37bOv54AaABAg,Как лабораторно подтвердить пищевую непереносимость?,2025-01-31T13:33:36Z,@theilyaefimov,UCTZ9c0lYLm1nVzor9iJhuKg,0,https://yt3.ggpht.com/ytc/AIdro_nb_izmwfFmt9UWr6nV1__tYmSQ_ydq0kXeGwpNDyGfxsA=s48-c-k-c0x00ffffff-no-rj,False,0,DGMc1CbsL54,Почему БОЛИТ ЖИВОТ?Высыпания?Простой тест на пищевые непереносимости бесплатно #nikolife #докторлиза,2025-01-29T14:30:09Z
UgyegDCw8GsFCfo2w9N4AaABAg,"Спасибо, док!❤",2025-01-29T16:52:11Z,@springmelody916,UCtZUZtjINKL0I2wrttD6p0w,0,https://yt3.ggpht.com/ytc/AIdro_n2udBzeYBteVO94AOvACDKqyHN4sBTqV2YenVzO3Y2Ic5h7sd9c1UhQi-g7V9kvb_L3A=s48-c-k-c0x00ffffff-no-rj,False,0,DGMc1CbsL54,Почему БОЛИТ ЖИВОТ?Высыпания?Простой тест на пищевые непереносимости бесплатно #nikolife #докторлиза,2025-01-29T14:30:09Z
UgwVnwfSnVsRyAY8Wid4AaABAg,Пришлите подборку сладостей,2025-01-27T15:27:48Z,@theilyaefimov,UCTZ9c0lYLm1nVzor9iJhuKg,0,https://yt3.ggpht.com/ytc/AIdro_nb_izmwfFmt9UWr6nV1__tYmSQ_ydq0kXeGwpNDyGfxsA=s48-c-k-c0x00ffffff-no-rj,False,1,BqUBnn4SnJM,ДАЮ ПОДБОРКУ ПОЛЕЗНЫХ СЛАДОСТЕЙ ДЛЯ ДЕТЕЙ - ОДОБРЕНО ДОКТОРОМ #докторлиза пиши комментарий!,2025-01-27T14:30:05Z
Ugx55ZjmjTbsxms7Z4B4AaABAg,Хочу подборку✨🔥,2025-02-13T06:57:32Z,@zaitseva_nasti,UCd7JLPIoIsQn57imMnxPxtQ,0,https://yt3.ggpht.com/lFpawR9qfJtdh6YXssTCw20Ov1Y0AEfWmHgLRg7TAHtlNX0Cw6qibI-Kh7NlIbN5AbPPkUM4Eg=s48-c-k-c0x00ffffff-no-rj,False,0,BqUBnn4SnJM,ДАЮ ПОДБОРКУ ПОЛЕЗНЫХ СЛАДОСТЕЙ ДЛЯ ДЕТЕЙ - ОДОБРЕНО ДОКТОРОМ #докторлиза пиши комментарий!,2025-01-27T14:30:05Z
Ugw1_RIRNuVM0w8twwp4AaABAg,Точно надо ❤,2025-01-28T15:27:55Z,@springmelody916,UCtZUZtjINKL0I2wrttD6p0w,0,https://yt3.ggpht.com/ytc/AIdro_n2udBzeYBteVO94AOvACDKqyHN4sBTqV2YenVzO3Y2Ic5h7sd9c1UhQi-g7V9kvb_L3A=s48-c-k-c0x00ffffff-no-rj,False,1,BqUBnn4SnJM,ДАЮ ПОДБОРКУ ПОЛЕЗНЫХ СЛАДОСТЕЙ ДЛЯ ДЕТЕЙ - ОДОБРЕНО ДОКТОРОМ #докторлиза пиши комментарий!,2025-01-27T14:30:05Z
UgxV9S-9ebbaPaRT54Z4AaABAg,"Хочу такую подборку для себя, не для ребенка",2025-01-28T14:55:02Z,@ВиксСмолякова,UCw2D47Jy-pjgf1vySV_BalA,0,https://yt3.ggpht.com/ytc/AIdro_myBJazhnvw4Uk8XJ6hN28r0uPDWqECyembfsXApsTuz4o=s48-c-k-c0x00ffffff-no-rj,False,1,BqUBnn4SnJM,ДАЮ ПОДБОРКУ ПОЛЕЗНЫХ СЛАДОСТЕЙ ДЛЯ ДЕТЕЙ - ОДОБРЕНО ДОКТОРОМ #докторлиза пиши комментарий!,2025-01-27T14:30:05Z
Ugwf2fHFZSjjhV2-xaB4AaABAg,Нужна подборка! 🎁,2025-01-27T15:03:39Z,@ЕлизаветаЕфимова-т8т,UCcHcMFbBbjdMgmOfyrnigiQ,0,https://yt3.ggpht.com/ytc/AIdro_nZzP1tQEFng0l0fugMfVkeLEqhDGFVLJdswWCCtxM=s48-c-k-c0x00ffffff-no-rj,False,1,BqUBnn4SnJM,ДАЮ ПОДБОРКУ ПОЛЕЗНЫХ СЛАДОСТЕЙ ДЛЯ ДЕТЕЙ - ОДОБРЕНО ДОКТОРОМ #докторлиза пиши комментарий!,2025-01-27T14:30:05Z
UgwCXHJZpq1LWmNX8gF4AaABAg,👍👍👍,2025-01-28T15:28:27Z,@springmelody916,UCtZUZtjINKL0I2wrttD6p0w,0,https://yt3.ggpht.com/ytc/AIdro_n2udBzeYBteVO94AOvACDKqyHN4sBTqV2YenVzO3Y2Ic5h7sd9c1UhQi-g7V9kvb_L3A=s48-c-k-c0x00ffffff-no-rj,False,1,6wJKDHvHGb0,ДИАГНОСТИКА АНЕМИИ БЕСПЛАТНО И БЫСТРО от #докторлиза #nikolife #педиатр,2025-01-25T14:30:05Z
UgzTEq0t4iImao-jKdJ4AaABAg,Не хочу выходить из комы 😅,2025-01-24T14:37:56Z,@ВиксСмолякова,UCw2D47Jy-pjgf1vySV_BalA,0,https://yt3.ggpht.com/ytc/AIdro_myBJazhnvw4Uk8XJ6hN28r0uPDWqECyembfsXApsTuz4o=s48-c-k-c0x00ffffff-no-rj,False,1,G-Q0U8PL8o0,ВОЗЬМИ МАКСИМУМ ПОЛЬЗЫ ОТ ЗАВТРАКА с #докторлиза #nikolife #завтрак #педиатр,2025-01-24T14:30:07Z
UgwK1KK_Ic5kRENUTqd4AaABAg,Можно фрукты есть на завтрак?,2025-01-24T14:37:13Z,@theilyaefimov,UCTZ9c0lYLm1nVzor9iJhuKg,0,https://yt3.ggpht.com/ytc/AIdro_nb_izmwfFmt9UWr6nV1__tYmSQ_ydq0kXeGwpNDyGfxsA=s48-c-k-c0x00ffffff-no-rj,False,1,G-Q0U8PL8o0,ВОЗЬМИ МАКСИМУМ ПОЛЬЗЫ ОТ ЗАВТРАКА с #докторлиза #nikolife #завтрак #педиатр,2025-01-24T14:30:07Z
UgxxbOxUpLAGlSWs9fx4AaABAg,Это реально проблема!!,2025-02-12T22:56:02Z,@zaitseva_nasti,UCd7JLPIoIsQn57imMnxPxtQ,0,https://yt3.ggpht.com/lFpawR9qfJtdh6YXssTCw20Ov1Y0AEfWmHgLRg7TAHtlNX0Cw6qibI-Kh7NlIbN5AbPPkUM4Eg=s48-c-k-c0x00ffffff-no-rj,False,0,M7cZL7kwK9g,НЕЛЬЗЯ ЕСТЬ САЛАТЫ ЗИМОЙ! Что делать? #докторлиза #nikolife #завтрак,2025-01-21T14:59:48Z
UgzmhPNpTj0dx6rdf7Z4AaABAg,Я больше не ем свежие салаты на завтрак,2025-01-24T14:36:44Z,@theilyaefimov,UCTZ9c0lYLm1nVzor9iJhuKg,0,https://yt3.ggpht.com/ytc/AIdro_nb_izmwfFmt9UWr6nV1__tYmSQ_ydq0kXeGwpNDyGfxsA=s48-c-k-c0x00ffffff-no-rj,False,1,M7cZL7kwK9g,НЕЛЬЗЯ ЕСТЬ САЛАТЫ ЗИМОЙ! Что делать? #докторлиза #nikolife #завтрак,2025-01-21T14:59:48Z
UgxYom5tzoP7emL0K0h4AaABAg,😋😋😋,2025-01-21T15:07:09Z,@СофьяДробышева-п9б,UCsaSO2S1ePmJL9IF7KKDbBg,0,https://yt3.ggpht.com/ytc/AIdro_mnL4OPZDwV0ZvwJiguMBZjFKDItNkMkZtzfc4GW9JuiFYMhEu_vCOr9oFwC0xho5j1CpY=s48-c-k-c0x00ffffff-no-rj,False,0,M7cZL7kwK9g,НЕЛЬЗЯ ЕСТЬ САЛАТЫ ЗИМОЙ! Что делать? #докторлиза #nikolife #завтрак,2025-01-21T14:59:48Z
UgxhWnavnFBcPSvz_394AaABAg,А если иногда есть мышечные подергивания?,2025-01-20T16:52:53Z,@ВиксСмолякова,UCw2D47Jy-pjgf1vySV_BalA,0,https://yt3.ggpht.com/ytc/AIdro_myBJazhnvw4Uk8XJ6hN28r0uPDWqECyembfsXApsTuz4o=s48-c-k-c0x00ffffff-no-rj,False,0,jaQ15Rnmkxc,"Плохо сплю, ноги сводит судорогой! Что делать? #докторлиза из #nikolife подскажет",2025-01-20T14:30:31Z
Ugyghm2t5rbEW4wggrN4AaABAg,Пью магний по назначению врача,2025-01-20T16:35:21Z,@theilyaefimov,UCTZ9c0lYLm1nVzor9iJhuKg,0,https://yt3.ggpht.com/ytc/AIdro_nb_izmwfFmt9UWr6nV1__tYmSQ_ydq0kXeGwpNDyGfxsA=s48-c-k-c0x00ffffff-no-rj,False,0,jaQ15Rnmkxc,"Плохо сплю, ноги сводит судорогой! Что делать? #докторлиза из #nikolife подскажет",2025-01-20T14:30:31Z
Ugx1AZs0Hjjsjjxc-TB4AaABAg,После приема магния во время беременности перестала просыпаться от судорог 😍,2025-01-20T15:30:40Z,@СофьяДробышева-п9б,UCsaSO2S1ePmJL9IF7KKDbBg,1,https://yt3.ggpht.com/ytc/AIdro_mnL4OPZDwV0ZvwJiguMBZjFKDItNkMkZtzfc4GW9JuiFYMhEu_vCOr9oFwC0xho5j1CpY=s48-c-k-c0x00ffffff-no-rj,False,0,jaQ15Rnmkxc,"Плохо сплю, ноги сводит судорогой! Что делать? #докторлиза из #nikolife подскажет",2025-01-20T14:30:31Z
UgzyMOqhnSPELhsEqt14AaABAg,"Основа рациона 🎉  спасибо! <br>Нашла печень трески классную в рыбном магазине у дома, в стекле",2025-01-28T15:29:44Z,@springmelody916,UCtZUZtjINKL0I2wrttD6p0w,0,https://yt3.ggpht.com/ytc/AIdro_n2udBzeYBteVO94AOvACDKqyHN4sBTqV2YenVzO3Y2Ic5h7sd9c1UhQi-g7V9kvb_L3A=s48-c-k-c0x00ffffff-no-rj,False,1,pIYcgDZJ-0A,5 ДОСТУПНЫХ И ПОЛЕЗНЫХ продуктов на ЗАВТРАК!Добавь эти продукты в свой рацион! #докторлиза #nikolife,2025-01-18T15:01:05Z
UgydlQC5BZX1XSrBI_x4AaABAg,"Спасибо, Лиза 😻перехожу на топленое масло и овощи на гриле 😋",2025-01-18T16:36:04Z,@СветланаЖуравлева-х2м,UCRkZPdZ15H--6ywx4mEFl-A,2,https://yt3.ggpht.com/ytc/AIdro_lZeiykQu3SJKcvUV9PRABECQK7Ir-eL37Zd_EdF9L6kcxa6BHZjhuo1kKFwGtzg-TeAhc=s48-c-k-c0x00ffffff-no-rj,False,0,pIYcgDZJ-0A,5 ДОСТУПНЫХ И ПОЛЕЗНЫХ продуктов на ЗАВТРАК!Добавь эти продукты в свой рацион! #докторлиза #nikolife,2025-01-18T15:01:05Z
UgyWEz_a5x3IyBC0owx4AaABAg,"Спасибо за видео,доктор, попробуем термически обработанные овощи добавить в завтрак",2025-01-18T15:56:28Z,@theilyaefimov,UCTZ9c0lYLm1nVzor9iJhuKg,2,https://yt3.ggpht.com/ytc/AIdro_nb_izmwfFmt9UWr6nV1__tYmSQ_ydq0kXeGwpNDyGfxsA=s48-c-k-c0x00ffffff-no-rj,False,0,pIYcgDZJ-0A,5 ДОСТУПНЫХ И ПОЛЕЗНЫХ продуктов на ЗАВТРАК!Добавь эти продукты в свой рацион! #докторлиза #nikolife,2025-01-18T15:01:05Z
Ugx4PiZXlp65zoSfEfV4AaABAg,Мы налегаем на редьку и капусту зимой 😍,2025-01-18T15:18:44Z,@СофьяДробышева-п9б,UCsaSO2S1ePmJL9IF7KKDbBg,2,https://yt3.ggpht.com/ytc/AIdro_mnL4OPZDwV0ZvwJiguMBZjFKDItNkMkZtzfc4GW9JuiFYMhEu_vCOr9oFwC0xho5j1CpY=s48-c-k-c0x00ffffff-no-rj,False,0,pIYcgDZJ-0A,5 ДОСТУПНЫХ И ПОЛЕЗНЫХ продуктов на ЗАВТРАК!Добавь эти продукты в свой рацион! #докторлиза #nikolife,2025-01-18T15:01:05Z
UgytW-h8n8GN6_vVXlR4AaABAg,"Вау 🎉🎉🎉<br><br>Я буду включать печень треску побольше 😎<br><br>Так классно, что не надо есть много свежих овощей 🙏зимой. Меня совсем на них не тянет",2025-01-18T15:16:36Z,@nikolife_nutrition,UCmefq5JW-K3Nt1gMsAkpysA,4,https://yt3.ggpht.com/jiysXBdI3R9YTep_WDiDdfKWguXUxa8F7kbCSDa8ZbFzVsJvPJpHqIsAkb07lpugExrVIZnezA=s48-c-k-c0x00ffffff-no-rj,False,0,pIYcgDZJ-0A,5 ДОСТУПНЫХ И ПОЛЕЗНЫХ продуктов на ЗАВТРАК!Добавь эти продукты в свой рацион! #докторлиза #nikolife,2025-01-18T15:01:05Z
UgzcrOw0ziRXZXz90Rx4AaABAg,Забираю на этот год информацию про жиры и разные виды рыб. Буду чаще их готовить 😊,2025-01-18T15:10:03Z,@ВиксСмолякова,UCw2D47Jy-pjgf1vySV_BalA,2,https://yt3.ggpht.com/ytc/AIdro_myBJazhnvw4Uk8XJ6hN28r0uPDWqECyembfsXApsTuz4o=s48-c-k-c0x00ffffff-no-rj,False,0,pIYcgDZJ-0A,5 ДОСТУПНЫХ И ПОЛЕЗНЫХ продуктов на ЗАВТРАК!Добавь эти продукты в свой рацион! #докторлиза #nikolife,2025-01-18T15:01:05Z
UgyVg4mGb2lhQA4wLo54AaABAg,Стоять могу 😜,2025-01-17T15:14:54Z,@nikolife_soul,UCETavPymqO45DF7iyeIAlCA,1,https://yt3.ggpht.com/ZiwR9XUJQr29y-u-2aqDj81zjgAuXbXMEVr0vAm7Ntxuni5plQt0F07imGWtmfXcPOQMgHhdoQ=s48-c-k-c0x00ffffff-no-rj,False,1,4K7kSQxVF6E,БЕСПЛАТНАЯ ДИАГНОСТИКА дефицита витамина В 12 дома! Вставай прямо сейчас! #докторлиза #nikolife,2025-01-17T14:30:02Z
UgzlOk8NQyDKb4pPbBh4AaABAg,Интересно),2025-01-17T15:00:09Z,@КристинаЖуравлева-б3б,UCpU6gVvWGQI_lcq_id-gx9w,0,https://yt3.ggpht.com/ytc/AIdro_lxlt5LIVZm1cf52SdMP_29nGjXFyReZUwGMPElIYrNMw=s48-c-k-c0x00ffffff-no-rj,False,1,4K7kSQxVF6E,БЕСПЛАТНАЯ ДИАГНОСТИКА дефицита витамина В 12 дома! Вставай прямо сейчас! #докторлиза #nikolife,2025-01-17T14:30:02Z
Ugwlffj-IjVgXShtF0V4AaABAg,"Встал, постоял какать захотел",2025-01-17T14:35:22Z,@tra1nk,UC7JQwMWXIyAmF69bZysd2cg,0,https://yt3.ggpht.com/ytc/AIdro_l8MSnsvbZOXMskxKM7YjaR7-2PrP5UrMzfkSK2Dt4QhDnDAIsc-IQGj7SUvr1G2OFtwLA=s48-c-k-c0x00ffffff-no-rj,False,2,4K7kSQxVF6E,БЕСПЛАТНАЯ ДИАГНОСТИКА дефицита витамина В 12 дома! Вставай прямо сейчас! #докторлиза #nikolife,2025-01-17T14:30:02Z
UgwxUvNtS5viLoEqJ5h4AaABAg,А если Магне В 6? 2 в 1 так сказать,2024-08-10T07:27:04Z,@peace4528,UC7fEHHNBy6PMVdO0MOlIgyg,0,https://yt3.ggpht.com/XOwi9t0cKdAvEgp_dVfQjGxOJw0BC5zUcNGb66gU8UQ3kPirO_OHT5wLt8iiNdkeSVRyNSEcTA=s48-c-k-c0x00ffffff-no-rj,False,0,mywTeBYpre4,"Пей ЭТО, чтобы чувствовать себя лучше УЖЕ СЕЙЧАС! #докторлиза #nikolife #витамины",2024-08-09T13:30:33Z
UgxKK36WbaYe-HwOTbt4AaABAg,исландский мох 🤢 но с кашлем борется отлично!,2024-08-07T20:33:43Z,@YoAniaYeah,UCXw34d-auHFGxUasX0agyCw,0,https://yt3.ggpht.com/ytc/AIdro_lui9XZWJ-nP0XZXPFqXh7eD0RB7ptZ3TaBEr4U6EBvndw=s48-c-k-c0x00ffffff-no-rj,False,0,62m-rjOgfNE,Как избавиться от КАШЛЯ? Без вреда и побочных эффектов #докторлиза #nikolife,2024-08-07T14:30:02Z
Ugwc7B4e-P78-bxJOwF4AaABAg,Огневка 😍,2024-08-07T16:43:54Z,@nikolife_soul,UCETavPymqO45DF7iyeIAlCA,0,https://yt3.ggpht.com/ZiwR9XUJQr29y-u-2aqDj81zjgAuXbXMEVr0vAm7Ntxuni5plQt0F07imGWtmfXcPOQMgHhdoQ=s48-c-k-c0x00ffffff-no-rj,False,0,62m-rjOgfNE,Как избавиться от КАШЛЯ? Без вреда и побочных эффектов #докторлиза #nikolife,2024-08-07T14:30:02Z
Ugx60hgJQ9uuTUK4Te54AaABAg,Редька с медом вкус детства 🤤🫶🏼,2024-08-07T14:49:26Z,@АннаХаблова-я6и,UCE_JyP2QpxMIa8ec8PcQOuA,0,https://yt3.ggpht.com/ytc/AIdro_nt5I3z1jYCvKqMdDjTdlPDXKigd4iygJ8-8B3Xiw4=s48-c-k-c0x00ffffff-no-rj,False,0,62m-rjOgfNE,Как избавиться от КАШЛЯ? Без вреда и побочных эффектов #докторлиза #nikolife,2024-08-07T14:30:02Z
UgxX14MkBFnl35ymAsN4AaABAg,коротко и полезно!спасибо,2024-08-07T14:47:19Z,@Jany_Radha_Ramana,UCGhbeWJhQTrG3klbjcZg-cw,0,https://yt3.ggpht.com/qB7MVZYP65veCzPyx1T8bCPzE5gy4YDG6I1LGuQJA24GpdJ9A9pMVXDr2SMaUGPmeZBryOsUIA=s48-c-k-c0x00ffffff-no-rj,False,0,62m-rjOgfNE,Как избавиться от КАШЛЯ? Без вреда и побочных эффектов #докторлиза #nikolife,2024-08-07T14:30:02Z
UgyryOvF2AecBls3Vhx4AaABAg,"Ой а я даже и не знала, что такое бывает 😢",2024-08-05T17:07:35Z,@nikolife_nutrition,UCmefq5JW-K3Nt1gMsAkpysA,0,https://yt3.ggpht.com/jiysXBdI3R9YTep_WDiDdfKWguXUxa8F7kbCSDa8ZbFzVsJvPJpHqIsAkb07lpugExrVIZnezA=s48-c-k-c0x00ffffff-no-rj,False,0,julsSisXVjk,Зуд и СЫПЬ ПОСЛЕ КУПАНИЯ? Взгляд от #докторлиза #nikolife,2024-08-05T14:30:17Z
UgyARHKF8Li7wKodr9t4AaABAg,вву🎉,2024-08-05T16:55:53Z,@Jany_Radha_Ramana,UCGhbeWJhQTrG3klbjcZg-cw,0,https://yt3.ggpht.com/qB7MVZYP65veCzPyx1T8bCPzE5gy4YDG6I1LGuQJA24GpdJ9A9pMVXDr2SMaUGPmeZBryOsUIA=s48-c-k-c0x00ffffff-no-rj,False,0,julsSisXVjk,Зуд и СЫПЬ ПОСЛЕ КУПАНИЯ? Взгляд от #докторлиза #nikolife,2024-08-05T14:30:17Z
